Sheet: Rozpočet 2016
A1: Rozpočet krajského sdružení Praha 2016
A2: přesné příjmy budou aktualizovány dle celostranického rozpočtu na rok 2016 a údajů finančního odboru, a to v průběhu jednání nebo v rámci nápravy nedostatků
A3: Rozpočtová položka | B3: volné | C3: veřejné | D3: celkem
A4: Příjmy | B4: of:=[.B5]+[.B6]+[.B7]+[.B11]+[.B12] -> 52400 | C4: of:=[.C5]+[.C6]+[.C7]+[.C11]+[.C12] -> 1715273 | D4: of:=[.D5]+[.D6]+[.D7]+[.D11]+[.D12] -> 1767673
A5: Převod výsledku hospodaření | B5: 39300 | C5: 553008 | D5: of:=[.B5]+[.C5] -> 592308
A6: Členské příspěvky | B6: 8600 | C6: 0 | D6: 8600
A7: Podíl na státních příspěvcích | B7: 0 | C7: of:=SUM([.C8:.C10]) -> 1162265 | D7: of:=SUM([.D8:.D10]) -> 1162265
A8: ├ Uvolněný volební příspěvek | B8: 0 | C8: 259765 | D8: 259765
A9: ├ Mandát senátor | B9: 0 | C9: 142500 | D9: 142500
A10: └ Mandát zastupitelé | B10: 0 | C10: 760000 | D10: 760000
A11: Hospodaření (tržby, prodej) | B11: 2000 | C11: 0 | D11: 2000
A12: Dary | B12: 2500 | C12: of:=SUM([.C13:.C16]) -> 0 | D12: of:=SUM([.D13:.D16]) -> 2500
A13: ├ Pirátské centrum | C13: 0 | D13: 0
A14: ├ Dary volby městské části | D14: 0
A15: ├ Dary volby celopražské | D15: 0
A16: └ Dary | B16: 2500 | D16: 2500
A17: Výdaje | B17: 18000 | C17: of:=[.C18]+[.C19]+[.C26] -> 1084000 | D17: of:=[.D18]+[.D19]+[.D26] -> 1084000
A18: Rezerva | C18: 40000 | D18: 40000
A19: Provozní výdaje | C19: of:=SUM([.C20:.C24]) -> 734000 | D19: of:=SUM([.D20:.D24]) -> 734000
A20: ├ Propagace a akce | C20: 70000 | D20: 70000
A21: ├ Pirátské centrum | C21: 40000 | D21: 40000
A22: ├ Klub zastupitelů | B22: 0 | C22: 480000 | D22: 480000
A23: ├ Kancelář senátora | C23: 44000 | D23: 44000
A24: ├ Koordinátor dobrovolníků | C24: 100000 | D24: 100000
A25: └ Krajský manažer | B25: 18000 | C25: 36000 | D25: 54000
A26: Volební výdaje | C26: 310000 | D26: 310000
A27: ├ Volby – městské části a senát | C27: 310000 | D27: 310000
A28: └ Volby – celopražské | C28: 0 | D28: 0
A29: Přebytek | B29: of:=[.B4]-[.B17] -> 34400 | C29: of:=[.C4]-[.C17] -> 631273 | D29: of:=[.D4]-[.D17] -> 683673
C30: 0 | D30: 0
D32: 0