Sheet: Rozpočet 2016
A1: Rozpočet krajského sdružení Praha 2016
A2: přesné příjmy budou aktualizovány dle celostranického rozpočtu na rok 2016 a údajů finančního odboru, a to v průběhu jednání nebo v rámci nápravy nedostatků
A3: Rozpočtová položka | B3: volné | C3: veřejné | D3: celkem
A4: Příjmy | B4: of:=[.B5]+[.B6]+[.B7]+[.B11]+[.B12] -> 72919.83 | C4: of:=[.C5]+[.C6]+[.C7]+[.C11]+[.C12] -> 1350505 | D4: of:=[.D5]+[.D6]+[.D7]+[.D11]+[.D12] -> 1423424.83
A5: Převod výsledku hospodaření | B5: 57919.83 | C5: 335730 | D5: 393649.83
A6: Členské příspěvky | B6: 10000 | D6: 10000
A7: Podíl na státních příspěvcích | C7: of:=SUM([.C8:.C10]) -> 1012775 | D7: of:=SUM([.D8:.D10]) -> 1012775
A8: ├ Uvolněný volební příspěvek | C8: 87000 | D8: 87000
A9: ├ Mandát senátor | C9: 165775 | D9: 165775
A10: └ Mandát zastupitelé | C10: 760000 | D10: 760000
A11: Tržby z prodeje | C11: 1000 | D11: 1000
A12: Dary | B12: of:=SUM([.B13:.B16]) -> 5000 | C12: of:=SUM([.C13:.C16]) -> 1000 | D12: of:=SUM([.D13:.D16]) -> 6000
A13: ├ Pirátské centrum | C13: 1000 | D13: 1000
A14: ├ Dary volby městské části | D14: 0
A15: ├ Dary volby celopražské | D15: 0
A16: └ Dary | B16: 5000 | D16: 5000
A17: Výdaje | B17: of:=[.B18]+[.B19]+[.B25]+[.B27] -> 18000 | C17: of:=[.C18]+[.C19]+[.C25]+[.C27] -> 1120000 | D17: of:=[.D18]+[.D19]+[.D25]+[.D27] -> 1138000
A18: Rezerva | C18: 40000 | D18: 40000
A19: Provozní výdaje | C19: of:=SUM([.C20:.C24]) -> 734000 | D19: of:=SUM([.D20:.D24]) -> 734000
A20: ├ Propagace a akce | C20: 70000 | D20: 70000
A21: ├ Pirátské centrum | C21: 40000 | D21: 40000
A22: ├ Klub zastupitelů | B22: 0 | C22: 480000 | D22: 480000
A23: ├ Kancelář senátora | C23: 44000 | D23: 44000
A24: └ Koordinátor dobrovolníků | C24: 100000 | D24: 100000
A25: Mzdové výdaje | B25: 18000 | C25: 36000 | D25: 54000
A26: └ Krajský manažer | B26: 18000 | C26: 36000 | D26: 54000
A27: Volební výdaje | C27: 310000 | D27: 310000
A28: ├ Volby – městské části a senát | C28: 310000 | D28: 310000
A29: └ Volby – celopražské | C29: 0 | D29: 0
A30: Přebytek | B30: of:=[.B4]-[.B17] -> 54919.83 | C30: of:=[.C4]-[.C17] -> 230505 | D30: of:=[.D4]-[.D17] -> 285424.83
A31: částky v tis. Kč
C32: 0 | D32: 0
D34: 0