Sheet: Rozpočtový výhled
A1: Rozpočtový výhled krajského sdružení Praha | G1: (aktualizováno dne 23. 12. 2015)
B2: skut. | E2: odhad | H2: výhled (predikce a plán)
B3: 2014 | E3: 2015 | H3: 2016 | K3: 2017 | N3: 2018 | Q3: 2019 | T3: 2020
B4: volné | C4: veřejné | D4: celkem | E4: volné | F4: veřejné | G4: celkem | H4: volné | I4: veřejné | J4: celkem | K4: volné | L4: veřejné | M4: celkem | N4: volné | O4: veřejné | P4: celkem | Q4: volné | R4: veřejné | S4: celkem | T4: volné | U4: veřejné | V4: celkem
A5: Příjmy | B5: of:=SUM([.B6:.B16]) -> 86875 | C5: of:=SUM([.C6:.C16]) -> 825571 | D5: of:=SUM([.D6:.D16]) -> 912446 | E5: of:=SUM([.E6:.E16]) -> 63619.83 | F5: of:=SUM([.F6:.F16]) -> 1094064 | G5: of:=[.E5]+[.F5] -> 1157683.83 | H5: of:=SUM([.H6:.H16]) -> 72919.83 | I5: of:=SUM([.I6:.I16]) -> 1350505 | J5: of:=[.H5]+[.I5] -> 1423424.83 | K5: of:=SUM([.K6:.K16]) -> 76919.83 | L5: of:=SUM([.L6:.L16]) -> 1455655 | M5: of:=[.K5]+[.L5] -> 1532574.83 | N5: of:=SUM([.N6:.N16]) -> 107919.83 | O5: of:=SUM([.O6:.O16]) -> 1958601 | P5: of:=[.N5]+[.O5] -> 2066520.83 | Q5: of:=SUM([.Q6:.Q16]) -> 29919.83 | R5: of:=SUM([.R6:.R16]) -> 1891950 | S5: of:=[.Q5]+[.R5] -> 1921869.83 | T5: of:=SUM([.T6:.T16]) -> 42919.83 | U5: of:=SUM([.U6:.U16]) -> 2280299 | V5: of:=[.T5]+[.U5] -> 2323218.83
A6: Převod výsledku hospodaření | B6: 26579 | C6: 66531 | D6: of:=[.B6]+[.C6] -> 93110 | E6: of:=[.B31] -> 53321 | F6: of:=[.C31] -> 103276 | G6: of:=[.E6]+[.F6] -> 156597 | H6: of:=[.E31] -> 57919.83 | I6: of:=[.F31] -> 335730 | J6: of:=[.H6]+[.I6] -> 393649.83 | K6: of:=[.H31] -> 54919.83 | L6: of:=[.I31] -> 230505 | M6: of:=[.K6]+[.L6] -> 285424.83 | N6: of:=[.K31] -> 18919.83 | O6: of:=[.L31] -> 300655 | P6: of:=[.N6]+[.O6] -> 319574.83 | Q6: of:=[.N31] -> 9919.83 | R6: of:=[.O31] -> 3601 | S6: of:=[.Q6]+[.R6] -> 13520.83 | T6: of:=[.Q31] -> 11919.83 | U6: of:=[.R31] -> 391950 | V6: of:=[.T6]+[.U6] -> 403869.83
A7: Členské příspěvky | B7: 15251 | D7: of:=[.B7]+[.C7] -> 15251 | E7: 7730.83 | G7: of:=[.E7]+[.F7] -> 7730.83 | H7: 10000 | J7: of:=[.H7]+[.I7] -> 10000 | K7: 12000 | M7: of:=[.K7]+[.L7] -> 12000 | N7: 14000 | P7: of:=[.N7]+[.O7] -> 14000 | Q7: 15000 | S7: of:=[.Q7]+[.R7] -> 15000 | T7: 16000 | V7: of:=[.T7]+[.U7] -> 16000
A8: Uvolněný volební příspěvek | C8: 426540 | D8: of:=[.B8]+[.C8] -> 426540 | F8: 86588 | G8: of:=[.E8]+[.F8] -> 86588 | I8: 87000 | J8: of:=[.H8]+[.I8] -> 87000 | L8: 173000 | M8: of:=[.K8]+[.L8] -> 173000 | O8: of:=['Vstupní parametry'.B3]*2/5 -> 312796 | P8: of:=[.N8]+[.O8] -> 312796 | R8: of:=['Vstupní parametry'.B3]/10 -> 78199 | S8: of:=[.Q8]+[.R8] -> 78199 | U8: of:=['Vstupní parametry'.B3]/10 -> 78199 | V8: of:=[.T8]+[.U8] -> 78199
A9: Mandát senátor | C9: 142500 | D9: of:=[.B9]+[.C9] -> 142500 | F9: 142500 | G9: of:=[.E9]+[.F9] -> 142500 | I9: of:=(10*[.F9]+2*[.L9])/12 -> 165775 | J9: of:=[.H9]+[.I9] -> 165775 | L9: of:=['Vstupní parametry'.B4]*427500 -> 282150 | M9: of:=[.K9]+[.L9] -> 282150 | O9: of:=(10*[.L9]+2*[.R9])/12 -> 282150 | P9: of:=[.N9]+[.O9] -> 282150 | R9: of:=['Vstupní parametry'.B5]*427500 -> 282150 | S9: of:=[.Q9]+[.R9] -> 282150 | U9: of:=[.R9] -> 282150 | V9: of:=[.T9]+[.U9] -> 282150
A10: Mandát zastupitelé | C10: 190000 | D10: of:=[.C10] -> 190000 | F10: 760000 | G10: of:=[.E10]+[.F10] -> 760000 | I10: of:=[.F10] -> 760000 | J10: of:=[.H10]+[.I10] -> 760000 | L10: of:=[.I10] -> 760000 | M10: of:=[.K10]+[.L10] -> 760000 | O10: of:=(10*[.L10]+2*[.R10])/12 -> 855000 | P10: of:=[.N10]+[.O10] -> 855000 | R10: of:=['Vstupní parametry'.$B$6]*[.L10]/4 -> 1330000 | S10: of:=[.Q10]+[.R10] -> 1330000 | U10: of:=[.R10] -> 1330000 | V10: of:=[.T10]+[.U10] -> 1330000
A11: Stálý příspěvek | O11: of:=['Vstupní parametry'.B7] -> 198000 | P11: of:=[.N11]+[.O11] -> 198000 | R11: of:=[.O11] -> 198000 | S11: of:=[.Q11]+[.R11] -> 198000 | U11: of:=[.R11] -> 198000 | V11: of:=[.T11]+[.U11] -> 198000
A12: Prodej | B12: 4937 | D12: of:=[.B12] -> 4937 | F12: 1200 | G12: of:=[.E12]+[.F12] -> 1200 | I12: 1000 | J12: of:=[.H12]+[.I12] -> 1000 | L12: 10000 | M12: of:=[.K12]+[.L12] -> 10000 | O12: 10000 | P12: of:=[.N12]+[.O12] -> 10000 | S12: of:=[.Q12]+[.R12] -> 0 | V12: of:=[.T12]+[.U12] -> 0
A13: Pirátské centrum | B13: 1574 | D13: of:=[.B13] -> 1574 | F13: 500 | G13: of:=[.E13]+[.F13] -> 500 | I13: 1000 | J13: of:=[.H13]+[.I13] -> 1000 | M13: of:=[.K13]+[.L13] -> 0 | P13: of:=[.N13]+[.O13] -> 0 | S13: of:=[.Q13]+[.R13] -> 0 | V13: of:=[.T13]+[.U13] -> 0
A14: Dary volby městské části | B14: 23000 | D14: of:=[.B14] -> 23000 | G14: of:=[.E14]+[.F14] -> 0 | J14: of:=[.H14]+[.I14] -> 0 | M14: of:=[.K14]+[.L14] -> 0 | N14: 50000 | P14: of:=[.N14]+[.O14] -> 50000 | S14: of:=[.Q14]+[.R14] -> 0 | T14: 10000 | V14: of:=[.T14]+[.T14] -> 20000
A15: Dary volby celopražské | B15: 8524 | D15: 8524 | G15: of:=[.E15]+[.F15] -> 0 | J15: of:=[.H15]+[.I15] -> 0 | M15: of:=[.K15]+[.L15] -> 0 | N15: 20000 | P15: of:=[.N15]+[.O15] -> 20000 | S15: of:=[.Q15]+[.R15] -> 0 | V15: of:=[.T15]+[.U15] -> 0
A16: Dary | B16: 7010 | D16: of:=[.B16]+[.C16] -> 7010 | E16: 2568 | G16: of:=[.E16]+[.F16] -> 2568 | H16: 5000 | J16: of:=[.H16]+[.I16] -> 5000 | K16: 10000 | M16: of:=[.K16]+[.L16] -> 10000 | N16: 5000 | P16: of:=[.N16]+[.O16] -> 5000 | Q16: 5000 | S16: of:=[.Q16]+[.R16] -> 5000 | T16: 5000 | V16: of:=[.T16]+[.U16] -> 5000
A17: Výdaje | B17: of:=SUM([.B18:.B30]) -> 33554 | C17: of:=SUM([.C18:.C30]) -> 722295 | D17: of:=SUM([.D18:.D30]) -> 719526.29 | E17: of:=SUM([.E18:.E30]) -> 5700 | F17: of:=SUM([.F18:.F30]) -> 758334 | G17: of:=SUM([.G18:.G30]) -> 764034 | H17: of:=SUM([.H18:.H30]) -> 18000 | I17: of:=SUM([.I18:.I30]) -> 1120000 | J17: of:=SUM([.J18:.J30]) -> 1138000 | K17: of:=SUM([.K18:.K30]) -> 58000 | L17: of:=SUM([.L18:.L30]) -> 1155000 | M17: of:=SUM([.M18:.M30]) -> 1213000 | N17: of:=SUM([.N18:.N30]) -> 98000 | O17: of:=SUM([.O18:.O30]) -> 1955000 | P17: of:=SUM([.P18:.P30]) -> 2053000 | Q17: of:=SUM([.Q18:.Q30]) -> 18000 | R17: of:=SUM([.R18:.R30]) -> 1500000 | S17: of:=SUM([.S18:.S30]) -> 1518000 | T17: of:=SUM([.T18:.T30]) -> 28000 | U17: of:=SUM([.U18:.U30]) -> 1960000 | V17: of:=SUM([.V18:.V30]) -> 1988000
A18: Rezerva | B18: 10110 | C18: 14932 | D18: 25042 | E18: 5700 | F18: 18000 | G18: of:=[.E18]+[.F18] -> 23700 | I18: 40000 | J18: of:=[.H18]+[.I18] -> 40000 | L18: of:=[.I18] -> 40000 | M18: of:=[.K18]+[.L18] -> 40000 | O18: of:=[.L18] -> 40000 | P18: of:=[.N18]+[.O18] -> 40000 | R18: 100000 | S18: of:=[.Q18]+[.R18] -> 100000 | U18: 100000 | V18: of:=[.T18]+[.U18] -> 100000
A19: Propagace, pořádání akcí | B19: 0 | C19: 20000 | D19: 20335.3 | F19: 65167 | G19: of:=[.E19]+[.F19] -> 65167 | I19: 20000 | J19: of:=[.H19]+[.I19] -> 20000 | L19: 15000 | M19: of:=[.K19]+[.L19] -> 15000 | O19: 20000 | P19: of:=[.N19]+[.O19] -> 20000 | R19: 80000 | S19: of:=[.Q19]+[.R19] -> 80000 | U19: 80000 | V19: of:=[.T19]+[.U19] -> 80000
A20: Vzdělávací a informační akce | C20: 30089 | D20: 30089 | F20: 65167 | G20: of:=[.E20]+[.F20] -> 65167 | I20: 50000 | J20: of:=[.H20]+[.I20] -> 50000 | M20: of:=[.K20]+[.L20] -> 0 | P20: of:=[.N20]+[.O20] -> 0 | R20: 50000 | S20: of:=[.Q20]+[.R20] -> 50000 | V20: of:=[.T20]+[.U20] -> 0
A21: Služby veřejnosti | C21: 57357 | D21: 57357 | G21: of:=[.E21]+[.F21] -> 0 | J21: of:=[.H21]+[.I21] -> 0 | M21: of:=[.K21]+[.L21] -> 0 | P21: of:=[.N21]+[.O21] -> 0 | S21: of:=[.Q21]+[.R21] -> 0 | V21: of:=[.T21]+[.U21] -> 0
A22: Pirátské centrum | B22: 944 | C22: 145452 | D22: 146396 | F22: 37000 | G22: of:=[.E22]+[.F22] -> 37000 | I22: 40000 | J22: of:=[.H22]+[.I22] -> 40000 | L22: 40000 | M22: of:=[.K22]+[.L22] -> 40000 | O22: dále očekáváme, že bude placeno ze stálého příspěvku | V22: of:=[.T22]+[.U22] -> 0
A23: Volby – městské části a senát | B23: 15000 | C23: 42000 | D23: 57000 | G23: of:=[.E23]+[.F23] -> 0 | I23: 310000 | J23: of:=[.H23]+[.I23] -> 310000 | N23: 50000 | O23: 330000 | P23: of:=[.N23]+[.O23] -> 380000 | S23: of:=[.Q23]+[.R23] -> 0 | T23: 10000 | U23: 500000 | V23: of:=[.T23]+[.U23] -> 510000
A24: Volby – celopražské | B24: 7500 | C24: 294000 | D24: 311841.99 | G24: of:=[.E24]+[.F24] -> 0 | J24: of:=[.H24]+[.I24] -> 0 | K24: 40000 | L24: 300000 | M24: of:=[.K24]+[.L24] -> 340000 | N24: 30000 | O24: 590000 | P24: of:=[.N24]+[.O24] -> 620000 | R24: 150000 | S24: of:=[.Q24]+[.R24] -> 150000 | V24: of:=[.T24]+[.U24] -> 0
A25: Klub zastupitelů | C25: 71465 | D25: 71465 | F25: 480000 | G25: of:=[.E25]+[.F25] -> 480000 | H25: of:=[.G3] -> 0 | I25: of:=[.F25] -> 480000 | J25: of:=[.H25]+[.I25] -> 480000 | L25: of:=[.I25] -> 480000 | M25: of:=[.K25]+[.L25] -> 480000 | O25: of:=(10*[.L25]+2*[.R25])/12 -> 540000 | P25: of:=[.N25]+[.O25] -> 540000 | R25: of:=['Vstupní parametry'.$B$6]*[.L25]/4 -> 840000 | S25: of:=[.Q25]+[.R25] -> 840000 | U25: of:=[.R25] -> 840000 | V25: of:=[.T25]+[.U25] -> 840000
A26: Kancelář senátora | C26: 37000 | F26: 24000 | G26: of:=[.E26]+[.F26] -> 24000 | I26: of:=(10*[.F26]+2*[.L26])/12 -> 44000 | J26: of:=[.H26]+[.I26] -> 44000 | L26: of:=['Vstupní parametry'.B5]/0.33*60000+[.F26] -> 144000 | M26: of:=[.K26]+[.L26] -> 144000 | O26: of:=[.L26] -> 144000 | P26: of:=[.N26]+[.O26] -> 144000 | R26: of:=[.O26] -> 144000 | S26: of:=[.Q26]+[.R26] -> 144000 | U26: of:=[.R26] -> 144000 | V26: of:=[.T26]+[.U26] -> 144000
A27: Volební manažer | C27: 10000 | I27: 0 | J27: of:=[.H27]+[.I27] -> 0 | L27: of:=[.I27] -> 0 | M27: of:=[.K27]+[.L27] -> 0 | O27: 155000 | P27: of:=[.N27]+[.O27] -> 155000 | R27: 0 | S27: of:=[.Q27]+[.R27] -> 0 | U27: 160000 | V27: of:=[.T27]+[.U27] -> 160000
A28: Koordinátor dobrovolníků | I28: 100000 | J28: of:=[.H28]+[.I28] -> 100000 | L28: of:=[.I28] -> 100000 | M28: of:=[.K28]+[.L28] -> 100000 | O28: of:=[.L28] -> 100000 | P28: of:=[.N28]+[.O28] -> 100000 | R28: of:=[.O28] -> 100000 | S28: of:=[.Q28]+[.R28] -> 100000 | U28: of:=[.R28] -> 100000 | V28: of:=[.T28]+[.U28] -> 100000
A29: Provozní výdaje | F29: 45000 | G29: of:=[.E29]+[.F29] -> 45000 | J29: of:=[.H29]+[.I29] -> 0 | M29: of:=[.K29]+[.L29] -> 0 | P29: of:=[.N29]+[.O29] -> 0 | S29: of:=[.Q29]+[.R29] -> 0 | V29: of:=[.T29]+[.U29] -> 0
A30: Krajský manažer | F30: 24000 | G30: of:=[.E30]+[.F30] -> 24000 | H30: 18000 | I30: 36000 | J30: of:=[.H30]+[.I30] -> 54000 | K30: of:=[.H30] -> 18000 | L30: of:=[.I30] -> 36000 | M30: of:=[.K30]+[.L30] -> 54000 | N30: of:=[.K30] -> 18000 | O30: of:=[.L30] -> 36000 | P30: of:=[.N30]+[.O30] -> 54000 | Q30: of:=[.N30] -> 18000 | R30: of:=[.O30] -> 36000 | S30: of:=[.Q30]+[.R30] -> 54000 | T30: of:=[.Q30] -> 18000 | U30: of:=[.R30] -> 36000 | V30: of:=[.T30]+[.U30] -> 54000
A31: Výsledek hospodaření | B31: of:=[.B5]-[.B17] -> 53321 | C31: of:=[.C5]-[.C17] -> 103276 | D31: of:=[.D5]-[.D17] -> 192919.71 | E31: of:=[.E5]-[.E17] -> 57919.83 | F31: of:=[.F5]-[.F17] -> 335730 | G31: of:=[.G5]-[.G17] -> 393649.83 | H31: of:=[.H5]-[.H17] -> 54919.83 | I31: of:=[.I5]-[.I17] -> 230505 | J31: of:=[.J5]-[.J17] -> 285424.83 | K31: of:=[.K5]-[.K17] -> 18919.83 | L31: of:=[.L5]-[.L17] -> 300655 | M31: of:=[.M5]-[.M17] -> 319574.83 | N31: of:=[.N5]-[.N17] -> 9919.83 | O31: of:=[.O5]-[.O17] -> 3601 | P31: of:=[.P5]-[.P17] -> 13520.8300000001 | Q31: of:=[.Q5]-[.Q17] -> 11919.83 | R31: of:=[.R5]-[.R17] -> 391950 | S31: of:=[.S5]-[.S17] -> 403869.83 | T31: of:=[.T5]-[.T17] -> 14919.83 | U31: of:=[.U5]-[.U17] -> 320299 | V31: of:=[.V5]-[.V17] -> 335218.83
A32: Volby | B32: eurovolby komunální volby | H32: senátní volby krajské volby (ne Praha) | K32: sněmovní volby prezidentská kampaň | N32: prezidentské volby komunální volby senátní volby | Q32: eurovolby | T32: senátní volby krajské volby (ne Praha)

Sheet: Výtah z rozpočtového výhledu
A1: of:=['Rozpočtový výhled'.A1] -> Rozpočtový výhled krajského sdružení Praha
A2: Sečteno bez ohledu na zdroj
A3: of:=['Rozpočtový výhled'.A3] -> 0 | B3: of:=['Rozpočtový výhled'.B2] -> skut. | C3: of:=['Rozpočtový výhled'.E2] -> odhad | D3: of:=['Rozpočtový výhled'.H2] -> výhled (predikce a plán)
A4: of:=['Rozpočtový výhled'.A4] -> 0 | B4: of:=['Rozpočtový výhled'.B3] -> 2014 | C4: of:=['Rozpočtový výhled'.E3] -> 2015 | D4: of:=['Rozpočtový výhled'.H3] -> 2016 | E4: of:=['Rozpočtový výhled'.K3] -> 2017 | F4: of:=['Rozpočtový výhled'.N3] -> 2018 | G4: of:=['Rozpočtový výhled'.Q3] -> 2019 | H4: of:=['Rozpočtový výhled'.T3] -> 2020
A5: of:=['Rozpočtový výhled'.A5] -> Příjmy | B5: of:=['Rozpočtový výhled'.D5] -> 912446 | C5: of:=['Rozpočtový výhled'.G5] -> 1157683.83 | D5: of:=['Rozpočtový výhled'.J5] -> 1423424.83 | E5: of:=['Rozpočtový výhled'.M5] -> 1532574.83 | F5: of:=['Rozpočtový výhled'.P5] -> 2066520.83 | G5: of:=['Rozpočtový výhled'.S5] -> 1921869.83 | H5: of:=['Rozpočtový výhled'.V5] -> 2323218.83
A6: of:=['Rozpočtový výhled'.A6] -> Převod výsledku hospodaření | B6: of:=['Rozpočtový výhled'.D6] -> 93110 | C6: of:=['Rozpočtový výhled'.G6] -> 156597 | D6: of:=['Rozpočtový výhled'.J6] -> 393649.83 | E6: of:=['Rozpočtový výhled'.M6] -> 285424.83 | F6: of:=['Rozpočtový výhled'.P6] -> 319574.83 | G6: of:=['Rozpočtový výhled'.S6] -> 13520.83 | H6: of:=['Rozpočtový výhled'.V6] -> 403869.83
A7: of:=['Rozpočtový výhled'.A7] -> Členské příspěvky | B7: of:=['Rozpočtový výhled'.D7] -> 15251 | C7: of:=['Rozpočtový výhled'.G7] -> 7730.83 | D7: of:=['Rozpočtový výhled'.J7] -> 10000 | E7: of:=['Rozpočtový výhled'.M7] -> 12000 | F7: of:=['Rozpočtový výhled'.P7] -> 14000 | G7: of:=['Rozpočtový výhled'.S7] -> 15000 | H7: of:=['Rozpočtový výhled'.V7] -> 16000
A8: of:=['Rozpočtový výhled'.A8] -> Uvolněný volební příspěvek | B8: of:=['Rozpočtový výhled'.D8] -> 426540 | C8: of:=['Rozpočtový výhled'.G8] -> 86588 | D8: of:=['Rozpočtový výhled'.J8] -> 87000 | E8: of:=['Rozpočtový výhled'.M8] -> 173000 | F8: of:=['Rozpočtový výhled'.P8] -> 312796 | G8: of:=['Rozpočtový výhled'.S8] -> 78199 | H8: of:=['Rozpočtový výhled'.V8] -> 78199
A9: of:=['Rozpočtový výhled'.A9] -> Mandát senátor | B9: of:=['Rozpočtový výhled'.D9] -> 142500 | C9: of:=['Rozpočtový výhled'.G9] -> 142500 | D9: of:=['Rozpočtový výhled'.J9] -> 165775 | E9: of:=['Rozpočtový výhled'.M9] -> 282150 | F9: of:=['Rozpočtový výhled'.P9] -> 282150 | G9: of:=['Rozpočtový výhled'.S9] -> 282150 | H9: of:=['Rozpočtový výhled'.V9] -> 282150
A10: of:=['Rozpočtový výhled'.A10] -> Mandát zastupitelé | B10: of:=['Rozpočtový výhled'.D10] -> 190000 | C10: of:=['Rozpočtový výhled'.G10] -> 760000 | D10: of:=['Rozpočtový výhled'.J10] -> 760000 | E10: of:=['Rozpočtový výhled'.M10] -> 760000 | F10: of:=['Rozpočtový výhled'.P10] -> 855000 | G10: of:=['Rozpočtový výhled'.S10] -> 1330000 | H10: of:=['Rozpočtový výhled'.V10] -> 1330000
A11: of:=['Rozpočtový výhled'.A11] -> Stálý příspěvek | B11: of:=['Rozpočtový výhled'.D11] -> 0 | C11: of:=['Rozpočtový výhled'.G11] -> 0 | D11: of:=['Rozpočtový výhled'.J11] -> 0 | E11: of:=['Rozpočtový výhled'.M11] -> 0 | F11: of:=['Rozpočtový výhled'.P11] -> 198000 | G11: of:=['Rozpočtový výhled'.S11] -> 198000 | H11: of:=['Rozpočtový výhled'.V11] -> 198000
A12: of:=['Rozpočtový výhled'.A12] -> Prodej | B12: of:=['Rozpočtový výhled'.D12] -> 4937 | C12: of:=['Rozpočtový výhled'.G12] -> 1200 | D12: of:=['Rozpočtový výhled'.J12] -> 1000 | E12: of:=['Rozpočtový výhled'.M12] -> 10000 | F12: of:=['Rozpočtový výhled'.P12] -> 10000 | G12: of:=['Rozpočtový výhled'.S12] -> 0 | H12: of:=['Rozpočtový výhled'.V12] -> 0
A13: of:=['Rozpočtový výhled'.A13] -> Pirátské centrum | B13: of:=['Rozpočtový výhled'.D13] -> 1574 | C13: of:=['Rozpočtový výhled'.G13] -> 500 | D13: of:=['Rozpočtový výhled'.J13] -> 1000 | E13: of:=['Rozpočtový výhled'.M13] -> 0 | F13: of:=['Rozpočtový výhled'.P13] -> 0 | G13: of:=['Rozpočtový výhled'.S13] -> 0 | H13: of:=['Rozpočtový výhled'.V13] -> 0 | J13: vybrané časové řady rozpočtového výhledu:
A14: of:=['Rozpočtový výhled'.A14] -> Dary volby městské části | B14: of:=['Rozpočtový výhled'.D14] -> 23000 | C14: of:=['Rozpočtový výhled'.G14] -> 0 | D14: of:=['Rozpočtový výhled'.J14] -> 0 | E14: of:=['Rozpočtový výhled'.M14] -> 0 | F14: of:=['Rozpočtový výhled'.P14] -> 50000 | G14: of:=['Rozpočtový výhled'.S14] -> 0 | H14: of:=['Rozpočtový výhled'.V14] -> 20000
A15: of:=['Rozpočtový výhled'.A15] -> Dary volby celopražské | B15: of:=['Rozpočtový výhled'.D15] -> 8524 | C15: of:=['Rozpočtový výhled'.G15] -> 0 | D15: of:=['Rozpočtový výhled'.J15] -> 0 | E15: of:=['Rozpočtový výhled'.M15] -> 0 | F15: of:=['Rozpočtový výhled'.P15] -> 20000 | G15: of:=['Rozpočtový výhled'.S15] -> 0 | H15: of:=['Rozpočtový výhled'.V15] -> 0
A16: of:=['Rozpočtový výhled'.A16] -> Dary | B16: of:=['Rozpočtový výhled'.D16] -> 7010 | C16: of:=['Rozpočtový výhled'.G16] -> 2568 | D16: of:=['Rozpočtový výhled'.J16] -> 5000 | E16: of:=['Rozpočtový výhled'.M16] -> 10000 | F16: of:=['Rozpočtový výhled'.P16] -> 5000 | G16: of:=['Rozpočtový výhled'.S16] -> 5000 | H16: of:=['Rozpočtový výhled'.V16] -> 5000
A17: of:=['Rozpočtový výhled'.A17] -> Výdaje | B17: of:=['Rozpočtový výhled'.D17] -> 719526.29 | C17: of:=['Rozpočtový výhled'.G17] -> 764034 | D17: of:=['Rozpočtový výhled'.J17] -> 1138000 | E17: of:=['Rozpočtový výhled'.M17] -> 1213000 | F17: of:=['Rozpočtový výhled'.P17] -> 2053000 | G17: of:=['Rozpočtový výhled'.S17] -> 1518000 | H17: of:=['Rozpočtový výhled'.V17] -> 1988000
A18: of:=['Rozpočtový výhled'.A18] -> Rezerva | B18: of:=['Rozpočtový výhled'.D18] -> 25042 | C18: of:=['Rozpočtový výhled'.G18] -> 23700 | D18: of:=['Rozpočtový výhled'.J18] -> 40000 | E18: of:=['Rozpočtový výhled'.M18] -> 40000 | F18: of:=['Rozpočtový výhled'.P18] -> 40000 | G18: of:=['Rozpočtový výhled'.S18] -> 100000 | H18: of:=['Rozpočtový výhled'.V18] -> 100000
A19: of:=['Rozpočtový výhled'.A19] -> Propagace, pořádání akcí | B19: of:=['Rozpočtový výhled'.D19] -> 20335.3 | C19: of:=['Rozpočtový výhled'.G19] -> 65167 | D19: of:=['Rozpočtový výhled'.J19] -> 20000 | E19: of:=['Rozpočtový výhled'.M19] -> 15000 | F19: of:=['Rozpočtový výhled'.P19] -> 20000 | G19: of:=['Rozpočtový výhled'.S19] -> 80000 | H19: of:=['Rozpočtový výhled'.V19] -> 80000
A20: of:=['Rozpočtový výhled'.A20] -> Vzdělávací a informační akce | B20: of:=['Rozpočtový výhled'.D20] -> 30089 | C20: of:=['Rozpočtový výhled'.G20] -> 65167 | D20: of:=['Rozpočtový výhled'.J20] -> 50000 | E20: of:=['Rozpočtový výhled'.M20] -> 0 | F20: of:=['Rozpočtový výhled'.P20] -> 0 | G20: of:=['Rozpočtový výhled'.S20] -> 50000 | H20: of:=['Rozpočtový výhled'.V20] -> 0
A21: of:=['Rozpočtový výhled'.A21] -> Služby veřejnosti | B21: of:=['Rozpočtový výhled'.D21] -> 57357 | C21: of:=['Rozpočtový výhled'.G21] -> 0 | D21: of:=['Rozpočtový výhled'.J21] -> 0 | E21: of:=['Rozpočtový výhled'.M21] -> 0 | F21: of:=['Rozpočtový výhled'.P21] -> 0 | G21: of:=['Rozpočtový výhled'.S21] -> 0 | H21: of:=['Rozpočtový výhled'.V21] -> 0
A22: of:=['Rozpočtový výhled'.A22] -> Pirátské centrum | B22: of:=['Rozpočtový výhled'.D22] -> 146396 | C22: of:=['Rozpočtový výhled'.G22] -> 37000 | D22: of:=['Rozpočtový výhled'.J22] -> 40000 | E22: of:=['Rozpočtový výhled'.M22] -> 40000 | F22: of:=['Rozpočtový výhled'.P22] -> 0 | G22: of:=['Rozpočtový výhled'.S22] -> 0 | H22: of:=['Rozpočtový výhled'.V22] -> 0
A23: of:=['Rozpočtový výhled'.A23] -> Volby – městské části a senát | B23: of:=['Rozpočtový výhled'.D23] -> 57000 | C23: of:=['Rozpočtový výhled'.G23] -> 0 | D23: of:=['Rozpočtový výhled'.J23] -> 310000 | E23: of:=['Rozpočtový výhled'.M23] -> 0 | F23: of:=['Rozpočtový výhled'.P23] -> 380000 | G23: of:=['Rozpočtový výhled'.S23] -> 0 | H23: of:=['Rozpočtový výhled'.V23] -> 510000
A24: of:=['Rozpočtový výhled'.A24] -> Volby – celopražské | B24: of:=['Rozpočtový výhled'.D24] -> 311841.99 | C24: of:=['Rozpočtový výhled'.G24] -> 0 | D24: of:=['Rozpočtový výhled'.J24] -> 0 | E24: of:=['Rozpočtový výhled'.M24] -> 340000 | F24: of:=['Rozpočtový výhled'.P24] -> 620000 | G24: of:=['Rozpočtový výhled'.S24] -> 150000 | H24: of:=['Rozpočtový výhled'.V24] -> 0
A25: of:=['Rozpočtový výhled'.A25] -> Klub zastupitelů | B25: of:=['Rozpočtový výhled'.D25] -> 71465 | C25: of:=['Rozpočtový výhled'.G25] -> 480000 | D25: of:=['Rozpočtový výhled'.J25] -> 480000 | E25: of:=['Rozpočtový výhled'.M25] -> 480000 | F25: of:=['Rozpočtový výhled'.P25] -> 540000 | G25: of:=['Rozpočtový výhled'.S25] -> 840000 | H25: of:=['Rozpočtový výhled'.V25] -> 840000
A26: of:=['Rozpočtový výhled'.A26] -> Kancelář senátora | B26: of:=['Rozpočtový výhled'.D26] -> 0 | C26: of:=['Rozpočtový výhled'.G26] -> 24000 | D26: of:=['Rozpočtový výhled'.J26] -> 44000 | E26: of:=['Rozpočtový výhled'.M26] -> 144000 | F26: of:=['Rozpočtový výhled'.P26] -> 144000 | G26: of:=['Rozpočtový výhled'.S26] -> 144000 | H26: of:=['Rozpočtový výhled'.V26] -> 144000
A27: of:=['Rozpočtový výhled'.A27] -> Volební manažer | B27: of:=['Rozpočtový výhled'.D27] -> 0 | C27: of:=['Rozpočtový výhled'.G27] -> 0 | D27: of:=['Rozpočtový výhled'.J27] -> 0 | E27: of:=['Rozpočtový výhled'.M27] -> 0 | F27: of:=['Rozpočtový výhled'.P27] -> 155000 | G27: of:=['Rozpočtový výhled'.S27] -> 0 | H27: of:=['Rozpočtový výhled'.V27] -> 160000
A28: of:=['Rozpočtový výhled'.A28] -> Koordinátor dobrovolníků | B28: of:=['Rozpočtový výhled'.D28] -> 0 | C28: of:=['Rozpočtový výhled'.G28] -> 0 | D28: of:=['Rozpočtový výhled'.J28] -> 100000 | E28: of:=['Rozpočtový výhled'.M28] -> 100000 | F28: of:=['Rozpočtový výhled'.P28] -> 100000 | G28: of:=['Rozpočtový výhled'.S28] -> 100000 | H28: of:=['Rozpočtový výhled'.V28] -> 100000
A29: of:=['Rozpočtový výhled'.A29] -> Provozní výdaje | B29: of:=['Rozpočtový výhled'.D29] -> 0 | C29: of:=['Rozpočtový výhled'.G29] -> 45000 | D29: of:=['Rozpočtový výhled'.J29] -> 0 | E29: of:=['Rozpočtový výhled'.M29] -> 0 | F29: of:=['Rozpočtový výhled'.P29] -> 0 | G29: of:=['Rozpočtový výhled'.S29] -> 0 | H29: of:=['Rozpočtový výhled'.V29] -> 0
A30: of:=['Rozpočtový výhled'.A30] -> Krajský manažer | B30: of:=['Rozpočtový výhled'.D30] -> 0 | C30: of:=['Rozpočtový výhled'.G30] -> 24000 | D30: of:=['Rozpočtový výhled'.J30] -> 54000 | E30: of:=['Rozpočtový výhled'.M30] -> 54000 | F30: of:=['Rozpočtový výhled'.P30] -> 54000 | G30: of:=['Rozpočtový výhled'.S30] -> 54000 | H30: of:=['Rozpočtový výhled'.V30] -> 54000
A31: of:=['Rozpočtový výhled'.A31] -> Výsledek hospodaření | B31: of:=['Rozpočtový výhled'.D31] -> 192919.71 | C31: of:=['Rozpočtový výhled'.G31] -> 393649.83 | D31: of:=['Rozpočtový výhled'.J31] -> 285424.83 | E31: of:=['Rozpočtový výhled'.M31] -> 319574.83 | F31: of:=['Rozpočtový výhled'.P31] -> 13520.8300000001 | G31: of:=['Rozpočtový výhled'.S31] -> 403869.83 | H31: of:=['Rozpočtový výhled'.V31] -> 335218.83
A32: of:=['Rozpočtový výhled'.A32] -> Volby

Sheet: Vstupní parametry
A1: Vstupní parametry modelu
A2: název parametru | B2: hodnota | C2: jednotka | D2: poznámka
A3: volební příspěvek pro Prahu | B3: 781990 | C3: Kč | D3: příspěvek za sněmovní volby 2017 – vypočítán za konzervativního předpokladu preferencí 3,3 % s podílem 30 % pro Prahu dle platných rozpočtových pravidel
A4: počet senátorů v roce 2016 | B4: 0.66 | C4: senátora | D4: konzervativně očekáváme, že k Liboru Michálkovi (0,33) přibude ještě aspoň třetina senátora (kandidáty stavíme ve 2 obvodech)
A5: počet senátorů zvolených v roce 2018 | B5: 0.66 | C5: senátora | D5: očekáváme, že Libor Michálek obhájí mandát a jinak nedojde ke změně
A6: počet zastupitelů hl. m. Prahy zvolených v roce 2018 | B6: 7 | C6: zastupitelů | D6: počet zastupitelů zvolených do Zastupitelstva hl. m. Prahy v roce 2018 odhadujeme optimisticky vzhledem k rostoucím preferencím a vysokému nasazení zastupitelského klubu
A7: očekávaný stálý příspěvek pro Prahu | B7: of:=6600000*0.2*0.15 -> 198000 | C7: Kč | D7: roční výše stálého příspěvku za sněmovní volby 2017 – vypočítán za konzervativního předpokladu preferencí 3,3 % s podílem 20 % pro Prahu dle platných rozpočtových pravidel a rozpočítání peněz dle počtu hlasů (rozdělení mezi kraji převzato z posledních sněmovních voleb)
A9: Komentář k rozpočtovému výhledu
A10: S výjimkou odhadu počtu zvolených zastupitelů do Zastupitelstva hl. m. Prahy v roce 2018 je rozpočtový výhled zpracován konzervativně. Drží se tím zásady opatrnosti ve finančním plánování. Skutečné příjmy budou při zvolení do poslanecké sněmovny podstatně vyšší (za předpokladu zvolení 2 poslanců v Praze jde o nezahrnutý příjem 855 tis. Kč na poslance a podílu na stálém příspěvku). Výdaje na volby jsou směřovány zejména do komunálních voleb 2018 a dále do sněmovních voleb 2017, které považujeme za prioritní, nicméně čekáme, že část výdajů bude placena z celostranického rozpočtu. Dále také navrhujeme dát část peněz na senátní kampaně těch kandidátů, kde máme velkou pravděpodobnost, že budou zvoleni. Tyto peníze užitečně alokované i z ekonomického hlediska, neboť lze očekávat podíl na příspěvku za senátora. Navrhujeme relativně nízký rozpočet pro další akce, protože se ukázalo, že nejsou finančně náročné a že předchozí rozpočty byly nadsazené. U některých položek (např. kampaně a pirátské centrum) je počítáno s kofinancováním z celostátních prostředků, ale výhled zachycuje pouze část financí krajského sdružení Praha. Rozpočtový výhled je zpracován s ohledem na platnou legislativu, zejména zákon č. 424/1991 Sb., o politických stranách, a dále v souladu s vnitřními předpisy, zejména rozpočtovými pravidly. V souladu s programem Pirátů je rozpočet konstruován jako vyrovnaný, resp. přebytkový. Pokud dojde ke změně těchto směrodatných dokumentů, je třeba rozpočtový výhled neprodleně aktualizovat. Rozpočtový výhled je dále třeba pravidelně aktualizovat každý rok s předkládáním krajského rozpočtu. Zdroje: https://docs.google.com/spreadsheets/d/1eHCwzBK5pzrxWcmGDNakJJ7Awly3tDJVDuT-s6T98uA/ http://www.zakonyprolidi.cz/cs/1991-424 https://www.pirati.cz/rules/ropr https://www.pirati.cz/fo/hospodareni2014/rozpocty/praha/start https://www.pirati.cz/fo/hospodareni2015/rozpocty/praha/start Zpracoval: zastupitel Pirátů Jakub Michálek s pomocí Jana Loužka, zveřejňovače klubu